  running PREP for EnKF-C version 1.110.1:
    command = "./enkf_prep enkf.prm"
    dir = "/home/pavel/src/enkf-c/trunk/enkf/examples/5"
  2020-03-11 13:10:32
  reading prep specs from "enkf.prm":
    MODE = EnKF
    SCHEME = DEnKF
    MODEL PRM = "model.prm"
    GRID PRM = "grid.prm"
    OBS TYPES PRM = "obstypes.prm"
    OBS PRM = "obs.prm"
    DATE = "6565.5 days since 1990-01-01"
    ENSEMBLE DIR = "ensemble_6565"
    ENSEMBLE SIZE = 96
    RFACTOR BASE = 2.0
    INFLATION BASE = 1.1000
    INFLATION MODE = SPREAD LIMITED, MAX RATIO = 1.00
    KFACTOR = 999.0
      LOCRAD  = 200
      LOCWEIGHT =  1
    STRIDE = 3
    FIELDBUFFERSIZE = 4
    REGION Global: x = [0.0, 360.0], y = [-90.0, 90.0]
    NCFORMAT = 64BIT
    NCCOMPRESSION = 0
    EnKF flags:
      enkf_exitaction  = [SEGFAULT]
      enkf_obstype     = [VALUE]
    compile flags:
      INTERNAL_QSORT_R = [-]
  reading observation specs from "obs.prm":
    PRODUCT = RADS
      READER = standard2
      TYPE = SLA
        File: obs/RADS-IB/y2007/m12/??_d19.nc
        File: obs/RADS-IB/y2007/m12/??_d20.nc
        File: obs/RADS-IB/y2007/m12/??_d21.nc
        File: obs/RADS-IB/y2007/m12/??_d22.nc
        File: obs/RADS-IB/y2007/m12/??_d23.nc
    PRODUCT = NAVO
      READER = standard
      TYPE = SST
        File: obs/NAVO/navo_20071219.nc
        File: obs/NAVO/navo_20071220.nc
        File: obs/NAVO/navo_20071221.nc
        File: obs/NAVO/navo_20071222.nc
        File: obs/NAVO/navo_20071223.nc
    PRODUCT = WindSat
      READER = standard
      TYPE = SST2
        File: obs/WINDSAT/windsat_20071219.nc
        File: obs/WINDSAT/windsat_20071220.nc
        File: obs/WINDSAT/windsat_20071221.nc
        File: obs/WINDSAT/windsat_20071222.nc
        File: obs/WINDSAT/windsat_20071223.nc
    PRODUCT = CARS
      READER = standard
      TYPE = TEM
        File: obs/TS-SEP-2011/y2007/m12/cars_temp_d19.nc
        File: obs/TS-SEP-2011/y2007/m12/cars_temp_d20.nc
        File: obs/TS-SEP-2011/y2007/m12/cars_temp_d21.nc
        File: obs/TS-SEP-2011/y2007/m12/cars_temp_d22.nc
        File: obs/TS-SEP-2011/y2007/m12/cars_temp_d23.nc
      ERROR_STD = 0.5, operation = EQUAL
    PRODUCT = CARS
      READER = standard
      TYPE = SAL
        File: obs/TS-SEP-2011/y2007/m12/cars_salt_d19.nc
        File: obs/TS-SEP-2011/y2007/m12/cars_salt_d20.nc
        File: obs/TS-SEP-2011/y2007/m12/cars_salt_d21.nc
        File: obs/TS-SEP-2011/y2007/m12/cars_salt_d22.nc
        File: obs/TS-SEP-2011/y2007/m12/cars_salt_d23.nc
      ERROR_STD = 0.1, operation = EQUAL
  creating model and observations:
    grid prm info:
      NAME = "t-grid"
      DOMAIN = Default
      DATA = "conf/grid_spec.nc"
      VTYPE = "z"
      ZVARNAME = "zt"
      ZCVARNAME = <none>
      DEPTHVARNAME = "depth_t"
      NUMLEVELSVARNAME = "num_levels"
      VDIR = "FROMSURF"
      XVARNAME = "lon"
      YVARNAME = "lat"
      ZSTATINTS = [0 50] [50 500] [500 9999] 
    grid info:
      hor type = LATLON
      periodic by X = no
      dims = 100 x 100 x 2
      longitude range = [0.000, 360.000]
      v type = Z
      v dir = FROMSURF
      STRIDE = 0
  reading observation type specs from "obstypes.prm":
    NAME = SLA
    ISSURFACE = 1
      VAR = eta_t
      ID = 0
      OFFSET = conf/eta_mean-bran.nc eta_t
      HFUNCTION = standard
      ALLOWED MIN = -1
      ALLOWED MAX = 1
      ASYNCHRONOUS = no
      LOCRAD  = 200
      LOCWEIGHT =  1
      RFACTOR = 2
    NAME = SST
    ISSURFACE = 1
      VAR = temp
      ID = 1
      HFUNCTION = standard
      ALLOWED MIN = -2
      ALLOWED MAX = 42
      ASYNCHRONOUS = no
      LOCRAD  = 200
      LOCWEIGHT =  1
      RFACTOR = 4
    NAME = SST2
    ISSURFACE = 1
      VAR = temp
      ID = 2
      HFUNCTION = standard
      ALLOWED MIN = -2
      ALLOWED MAX = 42
      ASYNCHRONOUS = no
      LOCRAD  = 200
      LOCWEIGHT =  1
      RFACTOR = 4
    NAME = TEM
    ISSURFACE = 0
      VAR = temp
      ID = 3
      HFUNCTION = standard
      ALLOWED MIN = -2
      ALLOWED MAX = 42
      ASYNCHRONOUS = no
      LOCRAD  = 800
      LOCWEIGHT =  1
      RFACTOR = 8
    NAME = SAL
    ISSURFACE = 0
      VAR = salt
      ID = 4
      HFUNCTION = standard
      ALLOWED MIN = 28
      ALLOWED MAX = 39
      ASYNCHRONOUS = no
      LOCRAD  = 800
      LOCWEIGHT =  1
      RFACTOR = 8
  reading observations:
    PRODUCT = RADS, TYPE = SLA, reader = standard2
      reading obs/RADS-IB/y2007/m12/e2_d19.nc:
        nobs = 5394
        error_std = 0.05
        # good obs = 0
      reading obs/RADS-IB/y2007/m12/j1_d19.nc:
        nobs = 50386
        error_std = 0.03
        # good obs = 18
      reading obs/RADS-IB/y2007/m12/n1_d19.nc:
        nobs = 40491
        error_std = 0.05
        # good obs = 233
      reading obs/RADS-IB/y2007/m12/e2_d20.nc:
        nobs = 6177
        error_std = 0.05
        # good obs = 0
      reading obs/RADS-IB/y2007/m12/j1_d20.nc:
        nobs = 50153
        error_std = 0.03
        # good obs = 0
      reading obs/RADS-IB/y2007/m12/n1_d20.nc:
        nobs = 39486
        error_std = 0.05
        # good obs = 0
      reading obs/RADS-IB/y2007/m12/e2_d21.nc:
        nobs = 5364
        error_std = 0.05
        # good obs = 0
      reading obs/RADS-IB/y2007/m12/j1_d21.nc:
        nobs = 51928
        error_std = 0.03
        # good obs = 345
      reading obs/RADS-IB/y2007/m12/n1_d21.nc:
        nobs = 39512
        error_std = 0.05
        # good obs = 22
      reading obs/RADS-IB/y2007/m12/e2_d22.nc:
        nobs = 5200
        error_std = 0.05
        # good obs = 0
      reading obs/RADS-IB/y2007/m12/j1_d22.nc:
        nobs = 51022
        error_std = 0.03
        # good obs = 68
      reading obs/RADS-IB/y2007/m12/n1_d22.nc:
        nobs = 41034
        error_std = 0.05
        # good obs = 295
      reading obs/RADS-IB/y2007/m12/e2_d23.nc:
        nobs = 6030
        error_std = 0.05
        # good obs = 0
      reading obs/RADS-IB/y2007/m12/j1_d23.nc:
        nobs = 49922
        error_std = 0.03
        # good obs = 0
      reading obs/RADS-IB/y2007/m12/n1_d23.nc:
        nobs = 38946
        error_std = 0.05
        # good obs = 0
      id = 0 - 980
      total 981 observations
      981 valid observations
      min day = -4.000
      max day = -1.000
    PRODUCT = NAVO, TYPE = SST, reader = standard
      reading obs/NAVO/navo_20071219.nc:
        ADDBIAS = NO
        nobs = 21372
        # good obs = 738
      reading obs/NAVO/navo_20071220.nc:
        ADDBIAS = NO
        nobs = 18990
        # good obs = 1682
      reading obs/NAVO/navo_20071221.nc:
        ADDBIAS = NO
        nobs = 31481
        # good obs = 1718
      reading obs/NAVO/navo_20071222.nc:
        ADDBIAS = NO
        nobs = 20804
        # good obs = 1598
      reading obs/NAVO/navo_20071223.nc:
        ADDBIAS = NO
        nobs = 28440
        # good obs = 1345
      id = 981 - 8061
      total 7081 observations
      7081 valid observations
      min day = -4.039
      max day = 0.453
    PRODUCT = WindSat, TYPE = SST2, reader = standard
      reading obs/WINDSAT/windsat_20071219.nc:
        nobs = 320738
        nobs = 320738
        # good obs = 1168
      reading obs/WINDSAT/windsat_20071220.nc:
        nobs = 29534
        nobs = 29534
        # good obs = 0
      id = 8062 - 9229
      total 1168 observations
      1168 valid observations
      min day = -4.000
      max day = -4.000
    PRODUCT = CARS, TYPE = TEM, reader = standard
      reading obs/TS-SEP-2011/y2007/m12/cars_temp_d19.nc:
        # profiles = 384
        # z levels = 191
        nobs = 548
        # unique locations = 383
        # good obs = 176
      reading obs/TS-SEP-2011/y2007/m12/cars_temp_d20.nc:
        # profiles = 377
        # z levels = 191
        nobs = 429
        # unique locations = 377
        # good obs = 56
      reading obs/TS-SEP-2011/y2007/m12/cars_temp_d21.nc:
        # profiles = 329
        # z levels = 191
        nobs = 376
        # unique locations = 329
        # good obs = 56
      reading obs/TS-SEP-2011/y2007/m12/cars_temp_d22.nc:
        # profiles = 350
        # z levels = 191
        nobs = 345
        # unique locations = 350
        # good obs = 0
      reading obs/TS-SEP-2011/y2007/m12/cars_temp_d23.nc:
        # profiles = 344
        # z levels = 191
        nobs = 336
        # unique locations = 344
        # good obs = 0
      id = 9230 - 9517
      total 288 observations
      184 valid observations
      setting error_std to 0.5
      min day = -4.000
      max day = -2.000
    PRODUCT = CARS, TYPE = SAL, reader = standard
      reading obs/TS-SEP-2011/y2007/m12/cars_salt_d19.nc:
        # profiles = 366
        # z levels = 191
        nobs = 530
        # unique locations = 365
        # good obs = 176
      reading obs/TS-SEP-2011/y2007/m12/cars_salt_d20.nc:
        # profiles = 360
        # z levels = 191
        nobs = 412
        # unique locations = 360
        # good obs = 56
      reading obs/TS-SEP-2011/y2007/m12/cars_salt_d21.nc:
        # profiles = 314
        # z levels = 191
        nobs = 362
        # unique locations = 314
        # good obs = 56
      reading obs/TS-SEP-2011/y2007/m12/cars_salt_d22.nc:
        # profiles = 323
        # z levels = 191
        nobs = 318
        # unique locations = 323
        # good obs = 0
      reading obs/TS-SEP-2011/y2007/m12/cars_salt_d23.nc:
        # profiles = 325
        # z levels = 191
        nobs = 317
        # unique locations = 325
        # good obs = 0
      id = 9518 - 9805
      total 288 observations
      184 valid observations
      setting error_std to 0.1
      min day = -4.000
      max day = -2.000
    compacting obs:
  writing observations to "observations-orig.nc":
  superobing:
    4112 superobservations
  writing superobservations to "observations.nc":
  reading super-observations from disk:
    4112 observations
    allocating 493440 bytes for array of observations
  checking for superobs on land:
    all good
  printing observation summary:
    type    #used    #dropped #out_grd #out_obs #out_wnd #land    #shallow #badbatch#badvalue#thinned #superobs
    -----------------------------------------------------------------------------------------------------------
    SLA     981      0        0        0        0        0        0        0        0        0        645     
    SST     7081     0        0        0        0        0        0        0        0        0        2285    
    SST2    1168     0        0        0        0        0        0        0        0        0        1168    
    TEM     184      104      104      0        0        0        0        0        0        0        7       
    SAL     184      104      104      0        0        0        0        0        0        0        7       
    total   9598     208      208      0        0        0        0        0        0        0        4112    
  2020-03-11 13:10:33
  finished
