  MPI: initialised 4 process(es)
  Using MPI-3 shared memory:
    sm_comm size = 4
    node_comm size = 1
  running CALC for EnKF-C version 2.43.0:
    command = "./enkf_calc --single-observation 156.0 -32.0 0 SST 0.5 0.5 singleob.prm"
    dir = "/home/599/pxs599/src/enkf-c.fieldsplit/enkf/examples/1"
  2025-12-24 08:32:43
  reading system specs from "singleob.prm":
    TIME = "6565.5 days since 1990-01-01"
    MODE = EnOI
    MODEL PRM = "model.prm"
    GRID PRM = "grid.prm"
    OBS TYPES PRM = "obstypes.prm"
    OBS PRM = "(null)"
    BGDIR = "background_6565"
    ENSEMBLE DIR = "ensemble_6565"
    ENSEMBLE SIZE = 96
    RFACTOR BASE = 1.0
    KFACTOR = 999.0
    LOCRAD  = 500
    LOCWEIGHT =  1
    STRIDE = 3
    REGION Global: x = [0.0, 360.0], y = [-90.0, 90.0]
    POINTLOG 156.000 -32.000 
    NCFORMAT = NETCDF4
    NCCOMPRESSION = 0
    EnKF flags:
      enkf_exitaction  = [BACKTRACE]
      enkf_obstype     = [VALUE]
    enkf_calc compile flags:
      SHUFFLE_ROWS     = [-]
      USE_SHMEM        = [+]
      MINIMISE_ALLOC   = [+]
      OBS_SHUFFLE      = [-]
      TW_VIAFILE       = [+]
      USE_MPIQUEUE     = [+]
      INTERNAL_QSORT_R = [-]
      DEFLATE_ALL      = [-]
  initialising the system:
  reading observation type specs from "obstypes.prm":
    NAME = SLA
    ISSURFACE = 1
      VAR = eta_t
      ID = 0
      OFFSET = conf/eta_mean-bran.nc eta_t
      HFUNCTION = standard
      ALLOWED MIN = -1
      ALLOWED MAX = 1
      ASYNCHRONOUS = no
      LOCRAD  = 500
      LOCWEIGHT =  1
      RFACTOR = 1
      PERMIT_LOCATION_BASED_THINNING = YES
    NAME = SST
    ISSURFACE = 1
      VAR = temp
      ID = 1
      HFUNCTION = standard
      ALLOWED MIN = -2
      ALLOWED MAX = 42
      ASYNCHRONOUS = no
      LOCRAD  = 500
      LOCWEIGHT =  1
      RFACTOR = 16
      PERMIT_LOCATION_BASED_THINNING = NO
    NAME = TEM
    ISSURFACE = 0
      VAR = temp
      ID = 2
      HFUNCTION = standard
      ALLOWED MIN = -2
      ALLOWED MAX = 42
      ASYNCHRONOUS = no
      LOCRAD  = 800
      LOCWEIGHT =  1
      RFACTOR = 4
      PERMIT_LOCATION_BASED_THINNING = YES
    NAME = SAL
    ISSURFACE = 0
      VAR = salt
      ID = 3
      HFUNCTION = standard
      ALLOWED MIN = 28
      ALLOWED MAX = 39
      ASYNCHRONOUS = no
      LOCRAD  = 800
      LOCWEIGHT =  1
      RFACTOR = 4
      PERMIT_LOCATION_BASED_THINNING = YES
    grid prm info:
      NAME = "t-grid"
      DOMAIN = ALL
      DATA = "conf/grid_spec.nc"
      VTYPE = "z"
      VDIR = FROMSURF
      GEOGRAPHIC = 1
      ZVARNAME = "zt"
      ZCVARNAME = <none>
      DEPTHVARNAME = "depth_t"
      NUMLEVELSVARNAME = "num_levels"
      VDIR = "FROMSURF"
      XVARNAME = "lon"
      YVARNAME = "lat"
      ZSTATINTS = [0 50] [50 500] [500 9999] 
    grid info:
      size = 100 x 100 x 2
      h type = RECTANGULAR
      periodic by X = no
      longitude range = [0.000, 360.000]
      v type = Z
      v dir = FROMSURF
      STRIDE = 0
  model info:
    name = Tasman
    5 variables:
      eta_t:
        grid = "t-grid"
      temp:
        grid = "t-grid"
      salt:
        grid = "t-grid"
      u:
        grid = "t-grid"
      v:
        grid = "t-grid"
  setting the ensemble size:
    96 members
  initialising pointlogs:
    pointlog (156.000, -32.000):
      t-grid: (i, j) = (49.500, 49.500)
  reading observation type specs from "obstypes.prm":
    NAME = SLA
    ISSURFACE = 1
      VAR = eta_t
      ID = 0
      OFFSET = conf/eta_mean-bran.nc eta_t
      HFUNCTION = standard
      ALLOWED MIN = -1
      ALLOWED MAX = 1
      ASYNCHRONOUS = no
      LOCRAD  = 500
      LOCWEIGHT =  1
      RFACTOR = 1
      PERMIT_LOCATION_BASED_THINNING = YES
    NAME = SST
    ISSURFACE = 1
      VAR = temp
      ID = 1
      HFUNCTION = standard
      ALLOWED MIN = -2
      ALLOWED MAX = 42
      ASYNCHRONOUS = no
      LOCRAD  = 500
      LOCWEIGHT =  1
      RFACTOR = 16
      PERMIT_LOCATION_BASED_THINNING = NO
    NAME = TEM
    ISSURFACE = 0
      VAR = temp
      ID = 2
      HFUNCTION = standard
      ALLOWED MIN = -2
      ALLOWED MAX = 42
      ASYNCHRONOUS = no
      LOCRAD  = 800
      LOCWEIGHT =  1
      RFACTOR = 4
      PERMIT_LOCATION_BASED_THINNING = YES
    NAME = SAL
    ISSURFACE = 0
      VAR = salt
      ID = 3
      HFUNCTION = standard
      ALLOWED MIN = 28
      ALLOWED MAX = 39
      ASYNCHRONOUS = no
      LOCRAD  = 800
      LOCWEIGHT =  1
      RFACTOR = 4
      PERMIT_LOCATION_BASED_THINNING = YES
  assimilating single observation:
    type = SST
    inn  = 0.500
    estd = 0.500
    lon  = 156.000
    lon  = -32.000
    i    = 49.500
    j    = 49.500
    creating kd-trees for observations:
      kdtree "SST":
        1 nodes
        112 bytes
  calculating ensemble observations:
  2025-12-24 08:32:43
    allocating 388 bytes for HE array:
    allocating 384 bytes for HE^T array:
    distributing 96 iterations:
      4 processes get 24 iterations each
    SLA 
    SST -........................
    TEM 
    SAL 
  gathering:
  2025-12-24 08:32:43
    subtracting ensemble mean:
  calculating innovations and spread:
  2025-12-24 08:32:43
  calculating transforms:
  2025-12-24 08:32:43
    calculating transforms for t-grid:
      main cycle for t-grid (34 x 34 local analyses):
        j = 0 (1: 0: 0.0%)
        j = 3 (2: 1: 2.9%)
        j = 6 (3: 2: 5.9%)
        j = 9 (1: 3: 8.8%)
        j = 12 (2: 4: 11.8%)
        j = 15 (3: 5: 14.7%)
        j = 18 (1: 6: 17.6%)
        j = 21 (2: 7: 20.6%)
        j = 24 (3: 8: 23.5%)
        j = 27 (1: 9: 26.5%)
        j = 30 (2: 10: 29.4%)
        j = 33 (3: 11: 32.4%)
        j = 36 (1: 12: 35.3%)
        j = 39 (2: 13: 38.2%)
        j = 42 (3: 14: 41.2%)
        j = 45 (1: 15: 44.1%)
        j = 48 (2: 16: 47.1%)
        j = 51 (3: 17: 50.0%)
        j = 54 (1: 18: 52.9%)
        j = 57 (2: 19: 55.9%)
        j = 60 (1: 20: 58.8%)
        j = 63 (3: 21: 61.8%)
        j = 66 (2: 22: 64.7%)
        j = 69 (3: 23: 67.6%)
        j = 72 (1: 24: 70.6%)
        j = 75 (2: 25: 73.5%)
        j = 78 (1: 26: 76.5%)
        j = 81 (3: 27: 79.4%)
        j = 84 (2: 28: 82.4%)
        j = 87 (1: 29: 85.3%)
        j = 90 (3: 30: 88.2%)
        j = 93 (2: 31: 91.2%)
        j = 96 (1: 32: 94.1%)
        j = 99 (3: 33: 97.1%)
      creating empty file "transforms.nc":
      assembling "transforms.nc":...
      assembling "enkf_diag.nc":...
    finished calculating transforms for t-grid
    summary stats on t-grid:
      # of local analyses = 1156
      average # of local obs = 0.7
      # of inversions in obs space = 830
      # of inversions in ens space = 0
  writing point logs:
    calculating transforms for log point (156.000,-32.000): 1 obs
    writing transforms for point (156.000,-32.000) on grid "t-grid":
  calculating analysed observations:
  2025-12-24 08:32:43
    sorting obs by ij:
    2025-12-24 08:32:43
    updating Hx:
    distributing 1 iterations:
      1 processes get 1 iteration, 3 processes get 0 iterations
    2025-12-24 08:32:43
  printing observation statistics:
    region obs.type   # obs.  |for.inn.| |an.inn.|   for.inn.   an.inn.  for.spread  an.spread
    ------------------------------------------------------------------------------------------
    Global
           SLA             0     -nan       -nan       -nan       -nan       -nan       -nan  
           SST             1      0.5       0.47        0.5       0.47       0.51       0.51  
             Virtual       1      0.5       0.47        0.5       0.47       0.51       0.51  
           TEM             0     -nan       -nan       -nan       -nan       -nan       -nan  
           SAL             0     -nan       -nan       -nan       -nan       -nan       -nan  
  2025-12-24 08:32:43
  finished
