  MPI: initialised 2 process(es)
  MPI: rank = 1, PID = 14237
  MPI: rank = 0, PID = 14236
  running CALC for EnKF-C version 1.98.0:
    command = "./enkf_calc --single-observation-ijk 35 55 0 SST 0.5 0.5 singleob.prm"
    dir = "/home/pavel/src/enkf-c/trunk/enkf/examples/1"
  2019-04-29 12:26:32
  reading system specs from "singleob.prm":
    MODE = EnOI
    MODEL PRM = "model.prm"
    GRID PRM = "grid.prm"
    OBS TYPES PRM = "obstypes.prm"
    OBS PRM = "(null)"
    DATE = "6565.5 days since 1990-01-01"
    BGDIR = "background_6565"
    ENSEMBLE DIR = "ensemble_6565"
    ENSEMBLE SIZE = 96
    RFACTOR BASE = 1.0
    INFLATION BASE = 1.0000
    INFLATION MODE = SPREAD LIMITED, MAX RATIO = 1.00
    KFACTOR = 999.0
      LOCRAD  = 500
      LOCWEIGHT =  1
    STRIDE = 3
    FIELDBUFFERSIZE = 4
    REGION Global: x = [0.0, 360.0], y = [-90.0, 90.0]
    POINTLOG 156.000 -32.000
    SOBSTRIDE = 1
    NCFORMAT = 64BIT
    NCCOMPRESSION = 0
    EnKF flags:
      enkf_exitaction  = [BACKTRACE]
      enkf_obstype     = [VALUE]
    compile flags:
      CHECK_X5         = [-]
      CHECK_G          = [-]
      SHUFFLE_ROWS     = [-]
      HE_VIAFILE       = [-]
      HE_VIASHMEM      = [+]
      MINIMISE_ALLOC   = [-]
      OBS_SHUFFLE      = [-]
      GRIDNODES_WRITE  = [-]
      INTERNAL_QSORT_R = [-]
      NO_GRIDUTILS     = [-]
  initialising the system:
  reading observation type specs from "obstypes.prm":
    NAME = SLA
    ISSURFACE = 1
      VAR = eta_t
      ID = 0
      OFFSET = conf/eta_mean-bran.nc eta_t
      HFUNCTION = standard
      ALLOWED MIN = -1
      ALLOWED MAX = 1
      ASYNCHRONOUS = no
      LOCRAD  = 500
      LOCWEIGHT =  1
      RFACTOR = 1
    NAME = SST
    ISSURFACE = 1
      VAR = temp
      ID = 1
      HFUNCTION = standard
      ALLOWED MIN = -2
      ALLOWED MAX = 42
      ASYNCHRONOUS = no
      LOCRAD  = 500
      LOCWEIGHT =  1
      RFACTOR = 2
    NAME = TEM
    ISSURFACE = 0
      VAR = temp
      ID = 2
      HFUNCTION = standard
      ALLOWED MIN = -2
      ALLOWED MAX = 42
      ASYNCHRONOUS = no
      LOCRAD  = 800
      LOCWEIGHT =  1
      RFACTOR = 4
    NAME = SAL
    ISSURFACE = 0
      VAR = salt
      ID = 3
      HFUNCTION = standard
      ALLOWED MIN = 28
      ALLOWED MAX = 39
      ASYNCHRONOUS = no
      LOCRAD  = 800
      LOCWEIGHT =  1
      RFACTOR = 4
    grid prm info:
      NAME = "t-grid"
      DOMAIN = Default
      DATA = "conf/grid_spec.nc"
      MAPTYPE = "B"
      VTYPE = "z"
      ZVARNAME = "zt"
      ZCVARNAME = <none>
      DEPTHVARNAME = "depth_t"
      NUMLEVELSVARNAME = "num_levels"
      VDIR = "FROMSURF"
      XVARNAME = "lon"
      YVARNAME = "lat"
      ZSTATINTS = [0 50] [50 500] [500 9999] 
    grid info:
      hor type = LATLON
      periodic by X = no
      dims = 100 x 100 x 2
      longitude range = [0.000, 360.000]
      v type = Z
      v dir = FROMSURF
  setting the ensemble size:
    96 members
  reading observation type specs from "obstypes.prm":
    NAME = SLA
    ISSURFACE = 1
      VAR = eta_t
      ID = 0
      OFFSET = conf/eta_mean-bran.nc eta_t
      HFUNCTION = standard
      ALLOWED MIN = -1
      ALLOWED MAX = 1
      ASYNCHRONOUS = no
      LOCRAD  = 500
      LOCWEIGHT =  1
      RFACTOR = 1
    NAME = SST
    ISSURFACE = 1
      VAR = temp
      ID = 1
      HFUNCTION = standard
      ALLOWED MIN = -2
      ALLOWED MAX = 42
      ASYNCHRONOUS = no
      LOCRAD  = 500
      LOCWEIGHT =  1
      RFACTOR = 2
    NAME = TEM
    ISSURFACE = 0
      VAR = temp
      ID = 2
      HFUNCTION = standard
      ALLOWED MIN = -2
      ALLOWED MAX = 42
      ASYNCHRONOUS = no
      LOCRAD  = 800
      LOCWEIGHT =  1
      RFACTOR = 4
    NAME = SAL
    ISSURFACE = 0
      VAR = salt
      ID = 3
      HFUNCTION = standard
      ALLOWED MIN = 28
      ALLOWED MAX = 39
      ASYNCHRONOUS = no
      LOCRAD  = 800
      LOCWEIGHT =  1
      RFACTOR = 4
  assimilating single observation:
    type = SST
    inn  = 0.500
    estd = 0.500
    lon  = 154.550
    lon  = -31.450
    i    = 35.000
    j    = 55.000
  calculating ensemble observations:
  2019-04-29 12:26:32
    allocating 768 bytes for HE array:
    distributing iterations:
      2 processes get 48 iterations each
    SLA 
    SST -................................................
    TEM 
    SAL 
  calculating transforms:
  2019-04-29 12:26:32
    creating kd-trees for observations:
    calculating transforms for t-grid:
    creating empty file "w.nc":
      distributing iterations:
        2 processes get 17 iterations each
      main cycle for t-grid (34 x 34 local analyses):
        j = 0 (0: 0: 5.9%)
        j = 3 (1: 17: 5.9%)
        j = 9 (1: 18: 11.8%)
        j = 15 (1: 19: 17.6%)
        j = 6 (0: 1: 11.8%)
        j = 12 (0: 2: 17.6%)
        j = 21 (1: 20: 23.5%)
        j = 18 (0: 3: 23.5%)
        j = 27 (1: 21: 29.4%)
        j = 24 (0: 4: 29.4%)
        j = 33 (1: 22: 35.3%)
        j = 30 (0: 5: 35.3%)
        j = 39 (1: 23: 41.2%)
        j = 36 (0: 6: 41.2%)
        j = 45 (1: 24: 47.1%)
        j = 42 (0: 7: 47.1%)
        j = 51 (1: 25: 52.9%)
        j = 48 (0: 8: 52.9%)
        j = 57 (1: 26: 58.8%)
        j = 54 (0: 9: 58.8%)
        j = 63 (1: 27: 64.7%)
        j = 69 (1: 28: 70.6%)
        j = 60 (0: 10: 64.7%)
        j = 75 (1: 29: 76.5%)
        j = 66 (0: 11: 70.6%)
        j = 81 (1: 30: 82.4%)
        j = 72 (0: 12: 76.5%)
        j = 87 (1: 31: 88.2%)
        j = 78 (0: 13: 82.4%)
        j = 93 (1: 32: 94.1%)
        j = 99 (1: 33: 100.0%)
        j = 84 (0: 14: 88.2%)
        j = 90 (0: 15: 94.1%)
        j = 96 (0: 16: 100.0%)
    finished calculating transforms for t-grid
    writing stats to "enkf_diag.nc":
    summary stats on t-grid:
      # of local analyses = 1156
      average # of local obs = 0.6
      # of inversions in obs space = 747
      # of inversions in ens space = 0
  writing point logs:
    calculating transforms for log point (156.000,-32.000): 1 obs
    writing log for point (156.000,-32.000) on grid "t-grid":
  calculating analysed observations:
  2019-04-29 12:26:32
    sorting obs by ij:
    2019-04-29 12:26:32
    updating Hx:
    distributing iterations:
      2 processes get 1 or 0 iterations
    2019-04-29 12:26:32
  printing observation statistics:
    region obs.type   # obs.  |for.inn.| |an.inn.|   for.inn.   an.inn.  for.spread  an.spread
    ------------------------------------------------------------------------------------------
    Global
           SST             1    0.500      0.468      0.500      0.468      0.186      0.186  
             Virtual       1    0.500      0.468      0.500      0.468      0.186      0.186  
  2019-04-29 12:26:32
  finished
