  MPI: initialised 2 process(es)
  Using MPI-3 shared memory:
    sm_comm size = 2
    node_comm size = 1
  running CALC for EnKF-C version 2.4.0:
    command = "./enkf_calc enoi.prm"
    dir = "/home/pavel/src/enkf-c/trunk/enkf/examples/4"
  2021-01-18 21:53:32
  reading system specs from "enoi.prm":
    MODE = EnOI
    MODEL PRM = "model.prm"
    GRID PRM = "grid.prm"
    OBS TYPES PRM = "obstypes.prm"
    OBS PRM = "obs.prm"
    DATE = "6565.5 days since 1990-01-01"
    BGDIR = "background_6565"
    ENSEMBLE DIR = "ensemble_static"
    ENSEMBLE SIZE = 144
    RFACTOR BASE = 1.0
    INFLATION BASE = 1.0000
    INFLATION MODE = CAPPED, MAX RATIO = 1.00
    KFACTOR = 999.0
      LOCRAD  = 200
      LOCWEIGHT =  1
    STRIDE = 3
    FIELDBUFFERSIZE = 4
    REGION Global: x = [0.0, 360.0], y = [-90.0, 90.0]
    POINTLOG 156.000 -32.000 
    NCFORMAT = NETCDF4
    NCCOMPRESSION = 0
    EnKF flags:
      enkf_exitaction  = [BACKTRACE]
      enkf_obstype     = [VALUE]
    enkf_calc compile flags:
      SHUFFLE_ROWS     = [-]
      USE_SHMEM        = [+]
      MINIMISE_ALLOC   = [+]
      OBS_SHUFFLE      = [-]
      TW_VIAFILE       = [-]
      INTERNAL_QSORT_R = [-]
      DEFLATE_ALL      = [-]
  initialising the system:
  reading observation type specs from "obstypes.prm":
    NAME = SLA
    ISSURFACE = 1
      VAR = eta_t
      ID = 0
      OFFSET = conf/eta_mean-bran.nc eta_t
      HFUNCTION = standard
      ALLOWED MIN = -1
      ALLOWED MAX = 1
      ASYNCHRONOUS = no
      LOCRAD  = 200
      LOCWEIGHT =  1
      RFACTOR = 1
      PERMIT_LOCATION_BASED_THINNING = YES
    NAME = SST
    ISSURFACE = 1
      VAR = temp
      ID = 1
      HFUNCTION = standard
      ALLOWED MIN = -2
      ALLOWED MAX = 42
      ASYNCHRONOUS = no
      LOCRAD  = 200
      LOCWEIGHT =  1
      RFACTOR = 16
      PERMIT_LOCATION_BASED_THINNING = NO
    NAME = TEM
    ISSURFACE = 0
      VAR = temp
      ID = 2
      HFUNCTION = standard
      ALLOWED MIN = -2
      ALLOWED MAX = 42
      ASYNCHRONOUS = no
      LOCRAD  = 800
      LOCWEIGHT =  1
      RFACTOR = 4
      PERMIT_LOCATION_BASED_THINNING = YES
    NAME = SAL
    ISSURFACE = 0
      VAR = salt
      ID = 3
      HFUNCTION = standard
      ALLOWED MIN = 28
      ALLOWED MAX = 39
      ASYNCHRONOUS = no
      LOCRAD  = 800
      LOCWEIGHT =  1
      RFACTOR = 4
      PERMIT_LOCATION_BASED_THINNING = YES
    grid prm info:
      NAME = "t-grid"
      DOMAIN = Default
      DATA = "conf4/grid_spec.nc"
      VTYPE = "z"
      ZVARNAME = "zt"
      ZCVARNAME = <none>
      DEPTHVARNAME = "depth_t"
      NUMLEVELSVARNAME = "num_levels"
      VDIR = "FROMSURF"
      XVARNAME = "lont"
      YVARNAME = "latt"
      ZSTATINTS = [0 50] [50 500] [500 9999] 
    grid info:
      hor type = LATLON
      periodic by X = no
      dims = 100 x 100 x 2
      longitude range = [0.000, 360.000]
      v type = Z
      v dir = FROMSURF
      STRIDE = 0
    grid prm info:
      NAME = "c-grid"
      DOMAIN = Default
      DATA = "conf4/grid_spec.nc"
      VTYPE = "z"
      ZVARNAME = "zt"
      ZCVARNAME = <none>
      NUMLEVELSVARNAME = "num_levels"
      VDIR = "FROMSURF"
      XVARNAME = "lonc"
      YVARNAME = "latc"
      ZSTATINTS = [0 50] [50 500] [500 9999] 
    grid info:
      hor type = LATLON
      periodic by X = no
      dims = 100 x 100 x 2
      longitude range = [0.000, 360.000]
      v type = Z
      v dir = FROMSURF
      STRIDE = 0
  model info:
    name = Tasman
    5 variables:
      eta_t:
        grid = "t-grid"
        inflation = 1.000 1.00
      temp:
        grid = "t-grid"
        inflation = 1.000 1.00
      salt:
        grid = "t-grid"
        inflation = 1.000 1.00
      u:
        grid = "c-grid"
        inflation = 1.000 1.00
      v:
        grid = "c-grid"
        inflation = 1.000 1.00
  setting the ensemble size:
    144 members
  initialising pointlogs:
    pointlog (156.000, -32.000):
      t-grid: (i, j) = (49.500, 49.500)
      c-grid: (i, j) = (49.000, 49.000)
  reading observations from "observations.nc":
    10228 observations
    allocating 1227360 bytes for array of observations
    creating kd-trees for observations:
      kdtree "SLA":
        660 nodes
        42288 bytes
      kdtree "SST":
        9554 nodes
        611504 bytes
      kdtree "TEM":
        7 nodes
        496 bytes
      kdtree "SAL":
        7 nodes
        496 bytes
  calculating ensemble observations:
  2021-01-18 21:53:32
    allocating 5932240 bytes for HE array:
    allocating 5891328 bytes for HE^T array:
    distributing 144 iterations:
      2 processes get 72 iterations each
    SLA +........................................................................
    SST +........................................................................
    TEM +........................................................................
    SAL +........................................................................
    subtracting ensemble mean:
  writing forecast innovations and spread to "observations.nc":
  2021-01-18 21:53:32
  moderating observations:
    observations substantially modified:
      SLA          0 (0.0%)
      SST          0 (0.0%)
      TEM          0 (0.0%)
      SAL          0 (0.0%)
      total        0 (0.0%)
  writing modified obs errors to "observations.nc":
  calculating transforms:
  2021-01-18 21:53:32
    calculating transforms for t-grid:
      distributing 34 iterations:
        2 processes get 17 iterations each
      creating empty file "transforms-0.nc":
      main cycle for t-grid (34 x 34 local analyses):
        j = 0 (0: 0: 5.9%)
        j = 3 (1: 17: 5.9%)
        j = 9 (1: 18: 11.8%)
        j = 6 (0: 1: 11.8%)
        j = 15 (1: 19: 17.6%)
        j = 12 (0: 2: 17.6%)
        j = 21 (1: 20: 23.5%)
        j = 18 (0: 3: 23.5%)
        j = 27 (1: 21: 29.4%)
        j = 24 (0: 4: 29.4%)
        j = 33 (1: 22: 35.3%)
        j = 30 (0: 5: 35.3%)
        j = 36 (0: 6: 41.2%)
        j = 39 (1: 23: 41.2%)
        j = 42 (0: 7: 47.1%)
        j = 45 (1: 24: 47.1%)
        j = 51 (1: 25: 52.9%)
        j = 48 (0: 8: 52.9%)
        j = 57 (1: 26: 58.8%)
        j = 54 (0: 9: 58.8%)
        j = 63 (1: 27: 64.7%)
        j = 60 (0: 10: 64.7%)
        j = 69 (1: 28: 70.6%)
        j = 66 (0: 11: 70.6%)
        j = 75 (1: 29: 76.5%)
        j = 72 (0: 12: 76.5%)
        j = 81 (1: 30: 82.4%)
        j = 78 (0: 13: 82.4%)
        j = 87 (1: 31: 88.2%)
        j = 84 (0: 14: 88.2%)
        j = 93 (1: 32: 94.1%)
        j = 90 (0: 15: 94.1%)
        j = 99 (1: 33: 100.0%)
        j = 96 (0: 16: 100.0%)
    finished calculating transforms for t-grid
    writing stats to "enkf_diag-0.nc":
    summary stats on t-grid:
      # of local analyses = 1156
      average # of local obs = 1050.2
      # of inversions in obs space = 57
      # of inversions in ens space = 1099
    calculating transforms for c-grid:
      distributing 34 iterations:
        2 processes get 17 iterations each
      creating empty file "transforms-1.nc":
      main cycle for c-grid (34 x 34 local analyses):
        j = 0 (0: 0: 5.9%)
        j = 3 (1: 17: 5.9%)
        j = 9 (1: 18: 11.8%)
        j = 6 (0: 1: 11.8%)
        j = 15 (1: 19: 17.6%)
        j = 12 (0: 2: 17.6%)
        j = 21 (1: 20: 23.5%)
        j = 18 (0: 3: 23.5%)
        j = 27 (1: 21: 29.4%)
        j = 24 (0: 4: 29.4%)
        j = 33 (1: 22: 35.3%)
        j = 30 (0: 5: 35.3%)
        j = 39 (1: 23: 41.2%)
        j = 36 (0: 6: 41.2%)
        j = 45 (1: 24: 47.1%)
        j = 42 (0: 7: 47.1%)
        j = 51 (1: 25: 52.9%)
        j = 48 (0: 8: 52.9%)
        j = 54 (0: 9: 58.8%)
        j = 57 (1: 26: 58.8%)
        j = 63 (1: 27: 64.7%)
        j = 60 (0: 10: 64.7%)
        j = 69 (1: 28: 70.6%)
        j = 66 (0: 11: 70.6%)
        j = 75 (1: 29: 76.5%)
        j = 72 (0: 12: 76.5%)
        j = 81 (1: 30: 82.4%)
        j = 78 (0: 13: 82.4%)
        j = 87 (1: 31: 88.2%)
        j = 84 (0: 14: 88.2%)
        j = 93 (1: 32: 94.1%)
        j = 90 (0: 15: 94.1%)
        j = 99 (1: 33: 100.0%)
        j = 96 (0: 16: 100.0%)
    finished calculating transforms for c-grid
    writing stats to "enkf_diag-1.nc":
    summary stats on c-grid:
      # of local analyses = 1156
      average # of local obs = 1053.4
      # of inversions in obs space = 56
      # of inversions in ens space = 1100
  writing point logs:
    calculating transforms for log point (156.000,-32.000): 1444 obs
    writing log for point (156.000,-32.000) on grid "t-grid":
    writing log for point (156.000,-32.000) on grid "c-grid":
  calculating analysed observations:
  2021-01-18 21:54:46
    sorting obs by ij:
    2021-01-18 21:54:46
    updating Hx:
    distributing 10228 iterations:
      2 processes get 5114 iterations each
    2021-01-18 21:54:46
  adding analysis innovations and spread to "observations.nc":
  printing observation statistics:
    region obs.type   # obs.  |for.inn.| |an.inn.|   for.inn.   an.inn.  for.spread  an.spread
    ------------------------------------------------------------------------------------------
    Global
           SLA           660   0.0766     0.0255     0.0216  -1.98e-05     0.0271     0.0271  
             j1          274    0.073     0.0222     0.0226    0.00075     0.0296     0.0296  
             n1          386   0.0791     0.0278     0.0208  -0.000567     0.0253     0.0253  
           SST          9554    0.456      0.186     -0.148    -0.0319      0.415      0.415  
             ESACCI     8386    0.457      0.158     -0.128    -0.0127      0.416      0.416  
             WindSat    1168    0.451       0.38      -0.29      -0.17      0.413      0.413  
           TEM             7     1.01      0.952      0.512      0.873      0.296      0.296  
             ARGO          7     1.01      0.952      0.512      0.873      0.296      0.296  
             0-50m         2     1.47       2.42       1.47       2.42      0.305      0.305  
             50-500m       5    0.832      0.366      0.129      0.255      0.293      0.293  
             500-9999m     0     -nan       -nan       -nan       -nan       -nan       -nan  
           SAL             7   0.0768     0.0834     0.0546     0.0549     0.0231     0.0231  
             ARGO          7   0.0768     0.0834     0.0546     0.0549     0.0231     0.0231  
             0-50m         2   0.0881      0.104     0.0739      0.078     0.0193     0.0193  
             50-500m       5   0.0723     0.0751     0.0469     0.0457     0.0246     0.0246  
             500-9999m     0     -nan       -nan       -nan       -nan       -nan       -nan  
  2021-01-18 21:54:46
  finished
